{
  "observation_id": "vcs-obs-003",
  "submitted_at": "2026-06-26T02:00:00Z",
  "observed_at": "2026-06-25T16:00:00Z",
  "observation_type": "wildlife_observation",
  "waterbody": "Clear Lake",
  "site_name": "Anderson Marsh",
  "latitude": 38.924,
  "longitude": -122.618,
  "location_precision": "exact",
  "location_privacy": "sensitive_habitat",
  "observer_type": "trained_volunteer",
  "evidence_type": "photo",
  "evidence_uri": "s3://example-bucket/photos/vcs-obs-003.jpg",
  "evidence_hash": "a1b2c3d4e5f7...",
  "description": "Nesting bird species observed in the marsh.",
  "source": "vcs_web_form",
  "quality_flag": "privacy_review_required",
  "review_status": "human_review_required",
  "provenance_status": "private_location_review",
  "simulated": true
}
