{
  "observation_id": "vcs-obs-004",
  "submitted_at": "2026-06-26T03:00:00Z",
  "observed_at": "2026-06-25T17:00:00Z",
  "observation_type": "trash_or_dumping_report",
  "waterbody": "Clear Lake",
  "site_name": "Lakeport waterfront",
  "latitude": 39.043,
  "longitude": -122.915,
  "location_precision": "approximate",
  "location_privacy": "public_site",
  "observer_type": "community_member",
  "evidence_type": "photo",
  "evidence_uri": "s3://example-bucket/photos/vcs-obs-004_blurry.jpg",
  "evidence_hash": "b2c3d4e5f6g7...",
  "description": "Large dumping site, but picture is extremely blurry and taken from moving car.",
  "source": "vcs_mobile_app",
  "quality_flag": "ambiguous",
  "review_status": "human_review_required",
  "provenance_status": "ambiguous_evidence_review",
  "simulated": true
}
